"Gene","padj_1","p_value_1","lfcSE.x","stat.x","log2FC_1","baseMean.x","Symbol.x","Description.x","Synonyms.x","GeneType.x","EnsemblGeneID.x","Status.x","ChrAcc.x","ChrStart.x","ChrStop.x","Orientation.x","Length.x","GOFunctionID.x","GOProcessID.x","GOComponentID.x","GOFunction.x","GOProcess.x","GOComponent.x","padj_2","p_value_2","lfcSE.y","stat.y","log2FC_2","baseMean.y","Symbol.y","Description.y","Synonyms.y","GeneType.y","EnsemblGeneID.y","Status.y","ChrAcc.y","ChrStart.y","ChrStop.y","Orientation.y","Length.y","GOFunctionID.y","GOProcessID.y","GOComponentID.y","GOFunction.y","GOProcess.y","GOComponent.y","Regulation"
728,0.0117,0.00169,0.4661,-3.140097,-1.4636149,51.3,"C5AR1","complement C5a receptor 1","C5A|C5AR|C5R1|CD88","protein-coding","ENSG00000197405","active","NC_000019.10","47309861","47322066","positive",2343,"GO:0004875///GO:0004878///GO:0004930","GO:0001774///GO:0002430///GO:0006935///GO:0006954///GO:0006955///GO:0006968///GO:0007165///GO:0007200///GO:0007202///GO:0007204///GO:0007606///GO:0010575///GO:0010759///GO:0030593///GO:0032494///GO:0038178///GO:0042789///GO:0045766///GO:0048143///GO:0050679///GO:0050830///GO:0050890///GO:0070374///GO:0090023///GO:0097242///GO:0099172///GO:1902947","GO:0005886///GO:0016323///GO:0030667///GO:0045177","complement receptor activity///complement component C5a receptor activity///G protein-coupled receptor activity","microglial cell activation///complement receptor mediated signaling pathway///chemotaxis///inflammatory response///immune response///cellular defense response///signal transduction///phospholipase C-activating G protein-coupled receptor signaling pathway///activation of phospholipase C activity///positive regulation of cytosolic calcium ion concentration///sensory perception of chemical stimulus///positive regulation of vascular endothelial growth factor production///positive regulation of macrophage chemotaxis///neutrophil chemotaxis///response to peptidoglycan///complement component C5a signaling pathway///mRNA transcription by RNA polymerase II///positive regulation of angiogenesis///astrocyte activation///positive regulation of epithelial cell proliferation///defense response to Gram-positive bacterium///cognition///positive regulation of ERK1 and ERK2 cascade///positive regulation of neutrophil chemotaxis///amyloid-beta clearance///presynapse organization///regulation of tau-protein kinase activity","plasma membrane///basolateral plasma membrane///secretory granule membrane///apical part of cell",0.7080703,0.441,0.3185,0.7699567,0.2452119,76.81,"C5AR1","complement C5a receptor 1","C5A|C5AR|C5R1|CD88","protein-coding","ENSG00000197405","active","NC_000019.10","47309861","47322066","positive",2343,"GO:0004875///GO:0004878///GO:0004930","GO:0001774///GO:0002430///GO:0006935///GO:0006954///GO:0006955///GO:0006968///GO:0007165///GO:0007200///GO:0007202///GO:0007204///GO:0007606///GO:0010575///GO:0010759///GO:0030593///GO:0032494///GO:0038178///GO:0042789///GO:0045766///GO:0048143///GO:0050679///GO:0050830///GO:0050890///GO:0070374///GO:0090023///GO:0097242///GO:0099172///GO:1902947","GO:0005886///GO:0016323///GO:0030667///GO:0045177","complement receptor activity///complement component C5a receptor activity///G protein-coupled receptor activity","microglial cell activation///complement receptor mediated signaling pathway///chemotaxis///inflammatory response///immune response///cellular defense response///signal transduction///phospholipase C-activating G protein-coupled receptor signaling pathway///activation of phospholipase C activity///positive regulation of cytosolic calcium ion concentration///sensory perception of chemical stimulus///positive regulation of vascular endothelial growth factor production///positive regulation of macrophage chemotaxis///neutrophil chemotaxis///response to peptidoglycan///complement component C5a signaling pathway///mRNA transcription by RNA polymerase II///positive regulation of angiogenesis///astrocyte activation///positive regulation of epithelial cell proliferation///defense response to Gram-positive bacterium///cognition///positive regulation of ERK1 and ERK2 cascade///positive regulation of neutrophil chemotaxis///amyloid-beta clearance///presynapse organization///regulation of tau-protein kinase activity","plasma membrane///basolateral plasma membrane///secretory granule membrane///apical part of cell","Downregulated"
730,0.0141,0.00219,0.4838,-3.063044,-1.4818325,71.72,"C7","complement C7","","protein-coding","ENSG00000112936","active","NC_000005.10","40909497","40984643","positive",5716,"","GO:0006956///GO:0006957///GO:0006958///GO:0019835///GO:0050778","GO:0005576///GO:0005579///GO:0005615///GO:0070062","","complement activation///complement activation, alternative pathway///complement activation, classical pathway///cytolysis///positive regulation of immune response","extracellular region///membrane attack complex///extracellular space///extracellular exosome",0.56892413,0.278,0.396,1.08531,0.4298315,84.43,"C7","complement C7","","protein-coding","ENSG00000112936","active","NC_000005.10","40909497","40984643","positive",5716,"","GO:0006956///GO:0006957///GO:0006958///GO:0019835///GO:0050778","GO:0005576///GO:0005579///GO:0005615///GO:0070062","","complement activation///complement activation, alternative pathway///complement activation, classical pathway///cytolysis///positive regulation of immune response","extracellular region///membrane attack complex///extracellular space///extracellular exosome","Downregulated"
759,0.00166,0.000114,0.3653,-3.859333,-1.4096252,52.25,"CA1","carbonic anhydrase 1","CA-I|CAB|Car1|HEL-S-11","protein-coding","ENSG00000133742","active","NC_000008.11","85327608","85378113","negative",2091,"GO:0004064///GO:0004089///GO:0005515///GO:0008270///GO:0016836///GO:0018820","GO:0006730","GO:0005737///GO:0005829///GO:0070062","arylesterase activity///carbonate dehydratase activity///protein binding///zinc ion binding///hydro-lyase activity///cyanamide hydratase activity","one-carbon metabolic process","cytoplasm///cytosol///extracellular exosome",0.89180472,0.752,0.2664,0.3155544,0.0840501,26.1,"CA1","carbonic anhydrase 1","CA-I|CAB|Car1|HEL-S-11","protein-coding","ENSG00000133742","active","NC_000008.11","85327608","85378113","negative",2091,"GO:0004064///GO:0004089///GO:0005515///GO:0008270///GO:0016836///GO:0018820","GO:0006730","GO:0005737///GO:0005829///GO:0070062","arylesterase activity///carbonate dehydratase activity///protein binding///zinc ion binding///hydro-lyase activity///cyanamide hydratase activity","one-carbon metabolic process","cytoplasm///cytosol///extracellular exosome","Downregulated"
871,0.00829,0.00105,0.4001,-3.276632,-1.3109677,163.86,"SERPINH1","serpin family H member 1","AsTP3|CBP1|CBP2|HSP47|OI10|PIG14|PPROM|RA-A47|SERPINH2|gp46","protein-coding","ENSG00000149257","active","NC_000011.10","75562253","75572811","positive",2597,"GO:0003723///GO:0004867///GO:0005515///GO:0005518///GO:0051082","GO:0003433///GO:0006986///GO:0010951///GO:0030199///GO:0032964///GO:0051604","GO:0005615///GO:0005783///GO:0005788///GO:0005793///GO:0045121///GO:0062023","RNA binding///serine-type endopeptidase inhibitor activity///protein binding///collagen binding///unfolded protein binding","chondrocyte development involved in endochondral bone morphogenesis///response to unfolded protein///negative regulation of endopeptidase activity///collagen fibril organization///collagen biosynthetic process///protein maturation","extracellular space///endoplasmic reticulum///endoplasmic reticulum lumen///endoplasmic reticulum-Golgi intermediate compartment///membrane raft///collagen-containing extracellular matrix",0.73623029,0.479,0.2474,0.7084792,0.1752752,319.94,"SERPINH1","serpin family H member 1","AsTP3|CBP1|CBP2|HSP47|OI10|PIG14|PPROM|RA-A47|SERPINH2|gp46","protein-coding","ENSG00000149257","active","NC_000011.10","75562253","75572811","positive",2597,"GO:0003723///GO:0004867///GO:0005515///GO:0005518///GO:0051082","GO:0003433///GO:0006986///GO:0010951///GO:0030199///GO:0032964///GO:0051604","GO:0005615///GO:0005783///GO:0005788///GO:0005793///GO:0045121///GO:0062023","RNA binding///serine-type endopeptidase inhibitor activity///protein binding///collagen binding///unfolded protein binding","chondrocyte development involved in endochondral bone morphogenesis///response to unfolded protein///negative regulation of endopeptidase activity///collagen fibril organization///collagen biosynthetic process///protein maturation","extracellular space///endoplasmic reticulum///endoplasmic reticulum lumen///endoplasmic reticulum-Golgi intermediate compartment///membrane raft///collagen-containing extracellular matrix","Downregulated"
929,0.0219,0.00409,0.4378,-2.870763,-1.2568757,151.06,"CD14","CD14 molecule","","protein-coding","ENSG00000170458","active","NC_000005.10","140631728","140633701","negative",1648,"GO:0001530///GO:0001847///GO:0005515///GO:0016019///GO:0070891///GO:0071723","GO:0006898///GO:0006909///GO:0006915///GO:0006954///GO:0007166///GO:0009408///GO:0031663///GO:0031666///GO:0032026///GO:0032481///GO:0032729///GO:0032757///GO:0032760///GO:0034142///GO:0034145///GO:0034612///GO:0045087///GO:0045471///GO:0045807///GO:0051602///GO:0071219///GO:0071222///GO:0071223///GO:0071726///GO:0071727///GO:1901224","GO:0005576///GO:0005615///GO:0005794///GO:0005886///GO:0009897///GO:0010008///GO:0030667///GO:0045121///GO:0046696///GO:0070062","lipopolysaccharide binding///opsonin receptor activity///protein binding///peptidoglycan immune receptor activity///lipoteichoic acid binding///lipopeptide binding","receptor-mediated endocytosis///phagocytosis///apoptotic process///inflammatory response///cell surface receptor signaling pathway///response to heat///lipopolysaccharide-mediated signaling pathway///positive regulation of lipopolysaccharide-mediated signaling pathway///response to magnesium ion///positive regulation of type I interferon production///positive regulation of type II interferon production///positive regulation of interleukin-8 production///positive regulation of tumor necrosis factor production///toll-like receptor 4 signaling pathway///positive regulation of toll-like receptor 4 signaling pathway///response to tumor necrosis factor///innate immune response///response to ethanol///positive regulation of endocytosis///response to electrical stimulus///cellular response to molecule of bacterial origin///cellular response to lipopolysaccharide///cellular response to lipoteichoic acid///cellular response to diacyl bacterial lipopeptide///cellular response to triacyl bacterial lipopeptide///positive regulation of NIK/NF-kappaB signaling","extracellular region///extracellular space///Golgi apparatus///plasma membrane///external side of plasma membrane///endosome membrane///secretory granule membrane///membrane raft///lipopolysaccharide receptor complex///extracellular exosome",0.5968506,0.31,0.4237,-1.016081,-0.4305216,470.25,"CD14","CD14 molecule","","protein-coding","ENSG00000170458","active","NC_000005.10","140631728","140633701","negative",1648,"GO:0001530///GO:0001847///GO:0005515///GO:0016019///GO:0070891///GO:0071723","GO:0006898///GO:0006909///GO:0006915///GO:0006954///GO:0007166///GO:0009408///GO:0031663///GO:0031666///GO:0032026///GO:0032481///GO:0032729///GO:0032757///GO:0032760///GO:0034142///GO:0034145///GO:0034612///GO:0045087///GO:0045471///GO:0045807///GO:0051602///GO:0071219///GO:0071222///GO:0071223///GO:0071726///GO:0071727///GO:1901224","GO:0005576///GO:0005615///GO:0005794///GO:0005886///GO:0009897///GO:0010008///GO:0030667///GO:0045121///GO:0046696///GO:0070062","lipopolysaccharide binding///opsonin receptor activity///protein binding///peptidoglycan immune receptor activity///lipoteichoic acid binding///lipopeptide binding","receptor-mediated endocytosis///phagocytosis///apoptotic process///inflammatory response///cell surface receptor signaling pathway///response to heat///lipopolysaccharide-mediated signaling pathway///positive regulation of lipopolysaccharide-mediated signaling pathway///response to magnesium ion///positive regulation of type I interferon production///positive regulation of type II interferon production///positive regulation of interleukin-8 production///positive regulation of tumor necrosis factor production///toll-like receptor 4 signaling pathway///positive regulation of toll-like receptor 4 signaling pathway///response to tumor necrosis factor///innate immune response///response to ethanol///positive regulation of endocytosis///response to electrical stimulus///cellular response to molecule of bacterial origin///cellular response to lipopolysaccharide///cellular response to lipoteichoic acid///cellular response to diacyl bacterial lipopeptide///cellular response to triacyl bacterial lipopeptide///positive regulation of NIK/NF-kappaB signaling","extracellular region///extracellular space///Golgi apparatus///plasma membrane///external side of plasma membrane///endosome membrane///secretory granule membrane///membrane raft///lipopolysaccharide receptor complex///extracellular exosome","Downregulated"
960,0.0332,0.00721,0.6144,-2.68701,-1.6510317,682.07,"CD44","CD44 molecule (Indian blood group)","CDW44|CSPG8|ECM-III|ECMR-III|H-CAM|HCELL|HUTCH-1|HUTCH-I|Hermes-1|IN|LHR|MC56|MDU2|MDU3|MIC4|Pgp1","protein-coding","ENSG00000026508","active","NC_000011.10","35139168","35232402","positive",7057,"GO:0004888///GO:0004896///GO:0005515///GO:0005518///GO:0005540","GO:0006954///GO:0007155///GO:0007160///GO:0016477///GO:0019221///GO:0030214///GO:0033138///GO:0034116///GO:0042110///GO:0043066///GO:0043154///GO:0043518///GO:0044319///GO:0044344///GO:0050731///GO:0051216///GO:0070374///GO:0070487///GO:0098609///GO:1900625///GO:1902166///GO:2000392","GO:0005794///GO:0005829///GO:0005886///GO:0005902///GO:0005925///GO:0009986///GO:0016323///GO:0016324///GO:0030667///GO:0031258///GO:0035692///GO:0042995///GO:0070062","transmembrane signaling receptor activity///cytokine receptor activity///protein binding///collagen binding///hyaluronic acid binding","inflammatory response///cell adhesion///cell-matrix adhesion///cell migration///cytokine-mediated signaling pathway///hyaluronan catabolic process///positive regulation of peptidyl-serine phosphorylation///positive regulation of heterotypic cell-cell adhesion///T cell activation///negative regulation of apoptotic process///negative regulation of cysteine-type endopeptidase activity involved in apoptotic process///negative regulation of DNA damage response, signal transduction by p53 class mediator///wound healing, spreading of cells///cellular response to fibroblast growth factor stimulus///positive regulation of peptidyl-tyrosine phosphorylation///cartilage development///positive regulation of ERK1 and ERK2 cascade///monocyte aggregation///cell-cell adhesion///positive regulation of monocyte aggregation///negative regulation of intrinsic apoptotic signaling pathway in response to DNA damage by p53 class mediator///regulation of lamellipodium morphogenesis","Golgi apparatus///cytosol///plasma membrane///microvillus///focal adhesion///cell surface///basolateral plasma membrane///apical plasma membrane///secretory granule membrane///lamellipodium membrane///macrophage migration inhibitory factor receptor complex///cell projection///extracellular exosome",0.99814254,0.996,0.4564,0.0049296,0.0022497,731.9,"CD44","CD44 molecule (Indian blood group)","CDW44|CSPG8|ECM-III|ECMR-III|H-CAM|HCELL|HUTCH-1|HUTCH-I|Hermes-1|IN|LHR|MC56|MDU2|MDU3|MIC4|Pgp1","protein-coding","ENSG00000026508","active","NC_000011.10","35139168","35232402","positive",7057,"GO:0004888///GO:0004896///GO:0005515///GO:0005518///GO:0005540","GO:0006954///GO:0007155///GO:0007160///GO:0016477///GO:0019221///GO:0030214///GO:0033138///GO:0034116///GO:0042110///GO:0043066///GO:0043154///GO:0043518///GO:0044319///GO:0044344///GO:0050731///GO:0051216///GO:0070374///GO:0070487///GO:0098609///GO:1900625///GO:1902166///GO:2000392","GO:0005794///GO:0005829///GO:0005886///GO:0005902///GO:0005925///GO:0009986///GO:0016323///GO:0016324///GO:0030667///GO:0031258///GO:0035692///GO:0042995///GO:0070062","transmembrane signaling receptor activity///cytokine receptor activity///protein binding///collagen binding///hyaluronic acid binding","inflammatory response///cell adhesion///cell-matrix adhesion///cell migration///cytokine-mediated signaling pathway///hyaluronan catabolic process///positive regulation of peptidyl-serine phosphorylation///positive regulation of heterotypic cell-cell adhesion///T cell activation///negative regulation of apoptotic process///negative regulation of cysteine-type endopeptidase activity involved in apoptotic process///negative regulation of DNA damage response, signal transduction by p53 class mediator///wound healing, spreading of cells///cellular response to fibroblast growth factor stimulus///positive regulation of peptidyl-tyrosine phosphorylation///cartilage development///positive regulation of ERK1 and ERK2 cascade///monocyte aggregation///cell-cell adhesion///positive regulation of monocyte aggregation///negative regulation of intrinsic apoptotic signaling pathway in response to DNA damage by p53 class mediator///regulation of lamellipodium morphogenesis","Golgi apparatus///cytosol///plasma membrane///microvillus///focal adhesion///cell surface///basolateral plasma membrane///apical plasma membrane///secretory granule membrane///lamellipodium membrane///macrophage migration inhibitory factor receptor complex///cell projection///extracellular exosome","Downregulated"
1017,0.00113,6.81e-05,0.3075,-3.982834,-1.2248478,50.42,"CDK2","cyclin dependent kinase 2","CDKN2|p33(CDK2)","protein-coding","ENSG00000123374","active","NC_000012.12","55966830","55972789","positive",2384,"GO:0000287///GO:0004674///GO:0004693///GO:0005515///GO:0005524///GO:0019904///GO:0030332///GO:0035173///GO:0097472///GO:0106310","GO:0000082///GO:0000086///GO:0000122///GO:0006260///GO:0006281///GO:0006351///GO:0006468///GO:0006813///GO:0007099///GO:0007165///GO:0007265///GO:0008284///GO:0010389///GO:0010468///GO:0016570///GO:0018105///GO:0031453///GO:0031571///GO:0032298///GO:0043687///GO:0045893///GO:0051298///GO:0051301///GO:0051321///GO:0071732///GO:0090398///GO:1905784","GO:0000307///GO:0000781///GO:0000793///GO:0000805///GO:0000806///GO:0001673///GO:0005634///GO:0005654///GO:0005667///GO:0005737///GO:0005768///GO:0005813///GO:0005829///GO:0015030///GO:0097123///GO:0097124///GO:0097134///GO:0097135","magnesium ion binding///protein serine/threonine kinase activity///cyclin-dependent protein serine/threonine kinase activity///protein binding///ATP binding///protein domain specific binding///cyclin binding///histone kinase activity///cyclin-dependent protein kinase activity///protein serine kinase activity","G1/S transition of mitotic cell cycle///G2/M transition of mitotic cell cycle///negative regulation of transcription by RNA polymerase II///DNA replication///DNA repair///DNA-templated transcription///protein phosphorylation///potassium ion transport///centriole replication///signal transduction///Ras protein signal transduction///positive regulation of cell population proliferation///regulation of G2/M transition of mitotic cell cycle///regulation of gene expression///histone modification///peptidyl-serine phosphorylation///positive regulation of heterochromatin formation///mitotic G1 DNA damage checkpoint signaling///positive regulation of DNA-templated DNA replication initiation///post-translational protein modification///positive regulation of DNA-templated transcription///centrosome duplication///cell division///meiotic cell cycle///cellular response to nitric oxide///cellular senescence///regulation of anaphase-promoting complex-dependent catabolic process","cyclin-dependent protein kinase holoenzyme complex///chromosome, telomeric region///condensed chromosome///X chromosome///Y chromosome///male germ cell nucleus///nucleus///nucleoplasm///transcription regulator complex///cytoplasm///endosome///centrosome///cytosol///Cajal body///cyclin A1-CDK2 complex///cyclin A2-CDK2 complex///cyclin E1-CDK2 complex///cyclin E2-CDK2 complex",0.665613,0.389,0.2392,-0.8622552,-0.2062131,53.18,"CDK2","cyclin dependent kinase 2","CDKN2|p33(CDK2)","protein-coding","ENSG00000123374","active","NC_000012.12","55966830","55972789","positive",2384,"GO:0000287///GO:0004674///GO:0004693///GO:0005515///GO:0005524///GO:0019904///GO:0030332///GO:0035173///GO:0097472///GO:0106310","GO:0000082///GO:0000086///GO:0000122///GO:0006260///GO:0006281///GO:0006351///GO:0006468///GO:0006813///GO:0007099///GO:0007165///GO:0007265///GO:0008284///GO:0010389///GO:0010468///GO:0016570///GO:0018105///GO:0031453///GO:0031571///GO:0032298///GO:0043687///GO:0045893///GO:0051298///GO:0051301///GO:0051321///GO:0071732///GO:0090398///GO:1905784","GO:0000307///GO:0000781///GO:0000793///GO:0000805///GO:0000806///GO:0001673///GO:0005634///GO:0005654///GO:0005667///GO:0005737///GO:0005768///GO:0005813///GO:0005829///GO:0015030///GO:0097123///GO:0097124///GO:0097134///GO:0097135","magnesium ion binding///protein serine/threonine kinase activity///cyclin-dependent protein serine/threonine kinase activity///protein binding///ATP binding///protein domain specific binding///cyclin binding///histone kinase activity///cyclin-dependent protein kinase activity///protein serine kinase activity","G1/S transition of mitotic cell cycle///G2/M transition of mitotic cell cycle///negative regulation of transcription by RNA polymerase II///DNA replication///DNA repair///DNA-templated transcription///protein phosphorylation///potassium ion transport///centriole replication///signal transduction///Ras protein signal transduction///positive regulation of cell population proliferation///regulation of G2/M transition of mitotic cell cycle///regulation of gene expression///histone modification///peptidyl-serine phosphorylation///positive regulation of heterochromatin formation///mitotic G1 DNA damage checkpoint signaling///positive regulation of DNA-templated DNA replication initiation///post-translational protein modification///positive regulation of DNA-templated transcription///centrosome duplication///cell division///meiotic cell cycle///cellular response to nitric oxide///cellular senescence///regulation of anaphase-promoting complex-dependent catabolic process","cyclin-dependent protein kinase holoenzyme complex///chromosome, telomeric region///condensed chromosome///X chromosome///Y chromosome///male germ cell nucleus///nucleus///nucleoplasm///transcription regulator complex///cytoplasm///endosome///centrosome///cytosol///Cajal body///cyclin A1-CDK2 complex///cyclin A2-CDK2 complex///cyclin E1-CDK2 complex///cyclin E2-CDK2 complex","Downregulated"
1052,0.000652,3.23e-05,0.3989,-4.156945,-1.65829,206.5,"CEBPD","CCAAT enhancer binding protein delta","C/EBP-delta|CELF|CRP3|NF-IL6-beta","protein-coding","ENSG00000221869","active","NC_000008.11","47736913","47738164","negative",1252,"GO:0000978///GO:0000981///GO:0001228///GO:0005515///GO:0042802///GO:1990837","GO:0002244///GO:0006357///GO:0006366///GO:0045444///GO:0045595///GO:0045669///GO:0045892///GO:0045944///GO:0048839///GO:0140467","GO:0000785///GO:0005634///GO:0005654///GO:0090575","RNA polymerase II cis-regulatory region sequence-specific DNA binding///DNA-binding transcription factor activity, RNA polymerase II-specific///DNA-binding transcription activator activity, RNA polymerase II-specific///protein binding///identical protein binding///sequence-specific double-stranded DNA binding","hematopoietic progenitor cell differentiation///regulation of transcription by RNA polymerase II///transcription by RNA polymerase II///fat cell differentiation///regulation of cell differentiation///positive regulation of osteoblast differentiation///negative regulation of DNA-templated transcription///positive regulation of transcription by RNA polymerase II///inner ear development///integrated stress response signaling","chromatin///nucleus///nucleoplasm///RNA polymerase II transcription regulator complex",0.93104325,0.837,0.2024,-0.2050933,-0.0415134,646.73,"CEBPD","CCAAT enhancer binding protein delta","C/EBP-delta|CELF|CRP3|NF-IL6-beta","protein-coding","ENSG00000221869","active","NC_000008.11","47736913","47738164","negative",1252,"GO:0000978///GO:0000981///GO:0001228///GO:0005515///GO:0042802///GO:1990837","GO:0002244///GO:0006357///GO:0006366///GO:0045444///GO:0045595///GO:0045669///GO:0045892///GO:0045944///GO:0048839///GO:0140467","GO:0000785///GO:0005634///GO:0005654///GO:0090575","RNA polymerase II cis-regulatory region sequence-specific DNA binding///DNA-binding transcription factor activity, RNA polymerase II-specific///DNA-binding transcription activator activity, RNA polymerase II-specific///protein binding///identical protein binding///sequence-specific double-stranded DNA binding","hematopoietic progenitor cell differentiation///regulation of transcription by RNA polymerase II///transcription by RNA polymerase II///fat cell differentiation///regulation of cell differentiation///positive regulation of osteoblast differentiation///negative regulation of DNA-templated transcription///positive regulation of transcription by RNA polymerase II///inner ear development///integrated stress response signaling","chromatin///nucleus///nucleoplasm///RNA polymerase II transcription regulator complex","Downregulated"
