"Gene","padj_1","p_value_1","lfcSE.x","stat.x","log2FC_1","baseMean.x","Symbol.x","Description.x","Synonyms.x","GeneType.x","EnsemblGeneID.x","Status.x","ChrAcc.x","ChrStart.x","ChrStop.x","Orientation.x","Length.x","GOFunctionID.x","GOProcessID.x","GOComponentID.x","GOFunction.x","GOProcess.x","GOComponent.x","padj_2","p_value_2","lfcSE.y","stat.y","log2FC_2","baseMean.y","Symbol.y","Description.y","Synonyms.y","GeneType.y","EnsemblGeneID.y","Status.y","ChrAcc.y","ChrStart.y","ChrStop.y","Orientation.y","Length.y","GOFunctionID.y","GOProcessID.y","GOComponentID.y","GOFunction.y","GOProcess.y","GOComponent.y","Regulation"
9595,0.000777,4.08e-05,0.386,-4.102947,-1.583879,28.98,"CYTIP","cytohesin 1 interacting protein","B3-1|CASP|CYBR|CYTHIP|HE|PSCDBP","protein-coding","ENSG00000115165","active","NC_000002.12","157412782","157444089","negative",4482,"GO:0005515","GO:0030155","GO:0005654///GO:0005737///GO:0005769///GO:0005829///GO:0005938","protein binding","regulation of cell adhesion","nucleoplasm///cytoplasm///early endosome///cytosol///cell cortex",0.69332926,0.422,0.4106,0.8027951,0.3296204,29.04,"CYTIP","cytohesin 1 interacting protein","B3-1|CASP|CYBR|CYTHIP|HE|PSCDBP","protein-coding","ENSG00000115165","active","NC_000002.12","157412782","157444089","negative",4482,"GO:0005515","GO:0030155","GO:0005654///GO:0005737///GO:0005769///GO:0005829///GO:0005938","protein binding","regulation of cell adhesion","nucleoplasm///cytoplasm///early endosome///cytosol///cell cortex","Downregulated"
9674,0.0325,0.00701,0.4146,-2.696485,-1.1180546,88.77,"KIAA0040","KIAA0040","","protein-coding","ENSG00000235750","active","NC_000001.11","175156986","175193295","negative",5059,"","","GO:0016020","","","membrane",0.84027631,0.655,0.2939,-0.4462232,-0.1311302,109.98,"KIAA0040","KIAA0040","","protein-coding","ENSG00000235750","active","NC_000001.11","175156986","175193295","negative",5059,"","","GO:0016020","","","membrane","Downregulated"
9976,6.13e-08,1.26e-10,0.2776,-6.432433,-1.785858,32.83,"CLEC2B","C-type lectin domain family 2 member B","AICL|CLECSF2|HP10085|IFNRG1","protein-coding","ENSG00000110852","active","NC_000012.12","9852369","9869859","negative",2038,"GO:0005515///GO:0030246///GO:0042802","","GO:0005886///GO:0009897","protein binding///carbohydrate binding///identical protein binding","","plasma membrane///external side of plasma membrane",0.86193464,0.694,0.3535,0.392896,0.1388852,26.32,"CLEC2B","C-type lectin domain family 2 member B","AICL|CLECSF2|HP10085|IFNRG1","protein-coding","ENSG00000110852","active","NC_000012.12","9852369","9869859","negative",2038,"GO:0005515///GO:0030246///GO:0042802","","GO:0005886///GO:0009897","protein binding///carbohydrate binding///identical protein binding","","plasma membrane///external side of plasma membrane","Downregulated"
10205,2.22e-11,3.9e-15,0.4161,-7.858144,-3.2699655,52.89,"MPZL2","myelin protein zero like 2","DFNB111|EVA|EVA1","protein-coding","ENSG00000149573","active","NC_000011.10","118253416","118264536","negative",3188,"GO:0005515","GO:0007156///GO:0009653///GO:0098609","GO:0005856///GO:0005886","protein binding","homophilic cell adhesion via plasma membrane adhesion molecules///anatomical structure morphogenesis///cell-cell adhesion","cytoskeleton///plasma membrane",0.91922573,0.811,0.3766,0.2388328,0.0899341,57.17,"MPZL2","myelin protein zero like 2","DFNB111|EVA|EVA1","protein-coding","ENSG00000149573","active","NC_000011.10","118253416","118264536","negative",3188,"GO:0005515","GO:0007156///GO:0009653///GO:0098609","GO:0005856///GO:0005886","protein binding","homophilic cell adhesion via plasma membrane adhesion molecules///anatomical structure morphogenesis///cell-cell adhesion","cytoskeleton///plasma membrane","Downregulated"
10288,0.0183,0.00318,0.4027,-2.949947,-1.1878625,15.2,"LILRB2","leukocyte immunoglobulin like receptor B2","CD85D|ILT-4|ILT4|LIR-2|LIR2|MIR-10|MIR10","protein-coding","ENSG00000131042","active","NC_000019.10","54273812","54281178","negative",3162,"GO:0001540///GO:0005515///GO:0008157///GO:0023025///GO:0023029///GO:0032396///GO:0042288///GO:0042803///GO:0044877///GO:0050839","GO:0002250///GO:0002578///GO:0002645///GO:0002666///GO:0002767///GO:0002774///GO:0006955///GO:0006968///GO:0007165///GO:0007166///GO:0007267///GO:0007611///GO:0019221///GO:0032755///GO:0034113///GO:0035307///GO:0042102///GO:0042130///GO:0045591///GO:0051248///GO:0051926///GO:0071222///GO:0140105///GO:1900271///GO:1900454///GO:1905875///GO:2000524///GO:2001198","GO:0005615///GO:0005737///GO:0005886///GO:0009986///GO:0016020///GO:0070821///GO:0101003","amyloid-beta binding///protein binding///protein phosphatase 1 binding///MHC class Ib protein complex binding///MHC class Ib protein binding///inhibitory MHC class I receptor activity///MHC class I protein binding///protein homodimerization activity///protein-containing complex binding///cell adhesion molecule binding","adaptive immune response///negative regulation of antigen processing and presentation///positive regulation of tolerance induction///positive regulation of T cell tolerance induction///immune response-inhibiting cell surface receptor signaling pathway///Fc receptor mediated inhibitory signaling pathway///immune response///cellular defense response///signal transduction///cell surface receptor signaling pathway///cell-cell signaling///learning or memory///cytokine-mediated signaling pathway///positive regulation of interleukin-6 production///heterotypic cell-cell adhesion///positive regulation of protein dephosphorylation///positive regulation of T cell proliferation///negative regulation of T cell proliferation///positive regulation of regulatory T cell differentiation///negative regulation of protein metabolic process///negative regulation of calcium ion transport///cellular response to lipopolysaccharide///interleukin-10-mediated signaling pathway///regulation of long-term synaptic potentiation///positive regulation of long-term synaptic depression///negative regulation of postsynaptic density organization///negative regulation of T cell costimulation///regulation of dendritic cell differentiation","extracellular space///cytoplasm///plasma membrane///cell surface///membrane///tertiary granule membrane///ficolin-1-rich granule membrane",0.26722955,0.0602,0.3093,-1.8793825,-0.5813746,32.14,"LILRB2","leukocyte immunoglobulin like receptor B2","CD85D|ILT-4|ILT4|LIR-2|LIR2|MIR-10|MIR10","protein-coding","ENSG00000131042","active","NC_000019.10","54273812","54281178","negative",3162,"GO:0001540///GO:0005515///GO:0008157///GO:0023025///GO:0023029///GO:0032396///GO:0042288///GO:0042803///GO:0044877///GO:0050839","GO:0002250///GO:0002578///GO:0002645///GO:0002666///GO:0002767///GO:0002774///GO:0006955///GO:0006968///GO:0007165///GO:0007166///GO:0007267///GO:0007611///GO:0019221///GO:0032755///GO:0034113///GO:0035307///GO:0042102///GO:0042130///GO:0045591///GO:0051248///GO:0051926///GO:0071222///GO:0140105///GO:1900271///GO:1900454///GO:1905875///GO:2000524///GO:2001198","GO:0005615///GO:0005737///GO:0005886///GO:0009986///GO:0016020///GO:0070821///GO:0101003","amyloid-beta binding///protein binding///protein phosphatase 1 binding///MHC class Ib protein complex binding///MHC class Ib protein binding///inhibitory MHC class I receptor activity///MHC class I protein binding///protein homodimerization activity///protein-containing complex binding///cell adhesion molecule binding","adaptive immune response///negative regulation of antigen processing and presentation///positive regulation of tolerance induction///positive regulation of T cell tolerance induction///immune response-inhibiting cell surface receptor signaling pathway///Fc receptor mediated inhibitory signaling pathway///immune response///cellular defense response///signal transduction///cell surface receptor signaling pathway///cell-cell signaling///learning or memory///cytokine-mediated signaling pathway///positive regulation of interleukin-6 production///heterotypic cell-cell adhesion///positive regulation of protein dephosphorylation///positive regulation of T cell proliferation///negative regulation of T cell proliferation///positive regulation of regulatory T cell differentiation///negative regulation of protein metabolic process///negative regulation of calcium ion transport///cellular response to lipopolysaccharide///interleukin-10-mediated signaling pathway///regulation of long-term synaptic potentiation///positive regulation of long-term synaptic depression///negative regulation of postsynaptic density organization///negative regulation of T cell costimulation///regulation of dendritic cell differentiation","extracellular space///cytoplasm///plasma membrane///cell surface///membrane///tertiary granule membrane///ficolin-1-rich granule membrane","Downregulated"
10388,0.000106,2.76e-06,0.2673,-4.688101,-1.2533227,505.71,"SYCP2","synaptonemal complex protein 2","SCP-2|SCP2|SPGF1","protein-coding","ENSG00000196074","active","NC_000020.11","59863277","59933700","negative",6541,"GO:0003677","GO:0000080///GO:0006915///GO:0007130///GO:0007140///GO:0007143///GO:0009566///GO:0035234///GO:0043066///GO:0048808///GO:0051093///GO:0051301///GO:0140013///GO:2000242","GO:0000795///GO:0000800///GO:0005634","DNA binding","mitotic G1 phase///apoptotic process///synaptonemal complex assembly///male meiotic nuclear division///female meiotic nuclear division///fertilization///ectopic germ cell programmed cell death///negative regulation of apoptotic process///male genitalia morphogenesis///negative regulation of developmental process///cell division///meiotic nuclear division///negative regulation of reproductive process","synaptonemal complex///lateral element///nucleus",0.3755897,0.12,0.2046,1.5528253,0.3176481,200.16,"SYCP2","synaptonemal complex protein 2","SCP-2|SCP2|SPGF1","protein-coding","ENSG00000196074","active","NC_000020.11","59863277","59933700","negative",6541,"GO:0003677","GO:0000080///GO:0006915///GO:0007130///GO:0007140///GO:0007143///GO:0009566///GO:0035234///GO:0043066///GO:0048808///GO:0051093///GO:0051301///GO:0140013///GO:2000242","GO:0000795///GO:0000800///GO:0005634","DNA binding","mitotic G1 phase///apoptotic process///synaptonemal complex assembly///male meiotic nuclear division///female meiotic nuclear division///fertilization///ectopic germ cell programmed cell death///negative regulation of apoptotic process///male genitalia morphogenesis///negative regulation of developmental process///cell division///meiotic nuclear division///negative regulation of reproductive process","synaptonemal complex///lateral element///nucleus","Downregulated"
10410,0.0036,0.000323,0.3569,-3.596281,-1.2833956,1270.82,"IFITM3","interferon induced transmembrane protein 3","1-8U|DSPA2b|IP15","protein-coding","ENSG00000142089","active","NC_000011.10","319676","320860","negative",611,"GO:0005515","GO:0006955///GO:0009615///GO:0032897///GO:0034341///GO:0035455///GO:0035456///GO:0045071///GO:0046597///GO:0051607///GO:0060337","GO:0005765///GO:0005886///GO:0031901///GO:0031902///GO:0032991///GO:0048471","protein binding","immune response///response to virus///negative regulation of viral transcription///response to type II interferon///response to interferon-alpha///response to interferon-beta///negative regulation of viral genome replication///negative regulation of viral entry into host cell///defense response to virus///type I interferon-mediated signaling pathway","lysosomal membrane///plasma membrane///early endosome membrane///late endosome membrane///protein-containing complex///perinuclear region of cytoplasm",0.34523287,0.102,0.2076,-1.6371962,-0.3398576,1548.3,"IFITM3","interferon induced transmembrane protein 3","1-8U|DSPA2b|IP15","protein-coding","ENSG00000142089","active","NC_000011.10","319676","320860","negative",611,"GO:0005515","GO:0006955///GO:0009615///GO:0032897///GO:0034341///GO:0035455///GO:0035456///GO:0045071///GO:0046597///GO:0051607///GO:0060337","GO:0005765///GO:0005886///GO:0031901///GO:0031902///GO:0032991///GO:0048471","protein binding","immune response///response to virus///negative regulation of viral transcription///response to type II interferon///response to interferon-alpha///response to interferon-beta///negative regulation of viral genome replication///negative regulation of viral entry into host cell///defense response to virus///type I interferon-mediated signaling pathway","lysosomal membrane///plasma membrane///early endosome membrane///late endosome membrane///protein-containing complex///perinuclear region of cytoplasm","Downregulated"
10437,0.0237,0.00457,0.4232,-2.836102,-1.200115,39.53,"IFI30","IFI30 lysosomal thiol reductase","GILT|IFI-30|IP-30|IP30","protein-coding","ENSG00000216490","active","NC_000019.10","18173813","18178117","positive",988,"GO:0005515///GO:0016491///GO:0016667///GO:0016671","GO:0019886///GO:0042590///GO:0048147///GO:0050821","GO:0005576///GO:0005764///GO:0005829///GO:0030054///GO:0043202///GO:0043231","protein binding///oxidoreductase activity///oxidoreductase activity, acting on a sulfur group of donors///oxidoreductase activity, acting on a sulfur group of donors, disulfide as acceptor","antigen processing and presentation of exogenous peptide antigen via MHC class II///antigen processing and presentation of exogenous peptide antigen via MHC class I///negative regulation of fibroblast proliferation///protein stabilization","extracellular region///lysosome///cytosol///cell junction///lysosomal lumen///intracellular membrane-bounded organelle",0.32635932,0.0902,0.3585,-1.6941736,-0.6074129,104.28,"IFI30","IFI30 lysosomal thiol reductase","GILT|IFI-30|IP-30|IP30","protein-coding","ENSG00000216490","active","NC_000019.10","18173813","18178117","positive",988,"GO:0005515///GO:0016491///GO:0016667///GO:0016671","GO:0019886///GO:0042590///GO:0048147///GO:0050821","GO:0005576///GO:0005764///GO:0005829///GO:0030054///GO:0043202///GO:0043231","protein binding///oxidoreductase activity///oxidoreductase activity, acting on a sulfur group of donors///oxidoreductase activity, acting on a sulfur group of donors, disulfide as acceptor","antigen processing and presentation of exogenous peptide antigen via MHC class II///antigen processing and presentation of exogenous peptide antigen via MHC class I///negative regulation of fibroblast proliferation///protein stabilization","extracellular region///lysosome///cytosol///cell junction///lysosomal lumen///intracellular membrane-bounded organelle","Downregulated"
10581,0.00408,0.000387,0.4127,-3.548839,-1.4645623,316.42,"IFITM2","interferon induced transmembrane protein 2","1-8D|DSPA2c","protein-coding","ENSG00000185201","active","NC_000011.10","308107","309410","positive",730,"","GO:0006955///GO:0009615///GO:0034341///GO:0035455///GO:0035456///GO:0035458///GO:0045071///GO:0046597///GO:0051607///GO:0060337","GO:0005654///GO:0005765///GO:0005886///GO:0030054///GO:0031902///GO:0032991","","immune response///response to virus///response to type II interferon///response to interferon-alpha///response to interferon-beta///cellular response to interferon-beta///negative regulation of viral genome replication///negative regulation of viral entry into host cell///defense response to virus///type I interferon-mediated signaling pathway","nucleoplasm///lysosomal membrane///plasma membrane///cell junction///late endosome membrane///protein-containing complex",0.78591628,0.554,0.2749,-0.5918661,-0.1626874,529.72,"IFITM2","interferon induced transmembrane protein 2","1-8D|DSPA2c","protein-coding","ENSG00000185201","active","NC_000011.10","308107","309410","positive",730,"","GO:0006955///GO:0009615///GO:0034341///GO:0035455///GO:0035456///GO:0035458///GO:0045071///GO:0046597///GO:0051607///GO:0060337","GO:0005654///GO:0005765///GO:0005886///GO:0030054///GO:0031902///GO:0032991","","immune response///response to virus///response to type II interferon///response to interferon-alpha///response to interferon-beta///cellular response to interferon-beta///negative regulation of viral genome replication///negative regulation of viral entry into host cell///defense response to virus///type I interferon-mediated signaling pathway","nucleoplasm///lysosomal membrane///plasma membrane///cell junction///late endosome membrane///protein-containing complex","Downregulated"
10628,3.49e-05,6.32e-07,0.2842,-4.981208,-1.415611,2158.3,"TXNIP","thioredoxin interacting protein","ARRDC6|EST01027|HHCPA78|THIF|VDUP1","protein-coding","ENSG00000265972","active","NC_000001.11","145992435","145996579","negative",3302,"GO:0004857///GO:0005515///GO:0031625","GO:0000122///GO:0006606///GO:0007049///GO:0009410///GO:0009612///GO:0009749///GO:0015031///GO:0030216///GO:0032355///GO:0032570///GO:0042127///GO:0042542///GO:0043065///GO:0043086///GO:0048008///GO:0051592///GO:0051782///GO:0071228","GO:0005634///GO:0005737///GO:0005758///GO:0005829","enzyme inhibitor activity///protein binding///ubiquitin protein ligase binding","negative regulation of transcription by RNA polymerase II///protein import into nucleus///cell cycle///response to xenobiotic stimulus///response to mechanical stimulus///response to glucose///protein transport///keratinocyte differentiation///response to estradiol///response to progesterone///regulation of cell population proliferation///response to hydrogen peroxide///positive regulation of apoptotic process///negative regulation of catalytic activity///platelet-derived growth factor receptor signaling pathway///response to calcium ion///negative regulation of cell division///cellular response to tumor cell","nucleus///cytoplasm///mitochondrial intermembrane space///cytosol",0.843152,0.66,0.3087,-0.4392298,-0.1355962,2814.09,"TXNIP","thioredoxin interacting protein","ARRDC6|EST01027|HHCPA78|THIF|VDUP1","protein-coding","ENSG00000265972","active","NC_000001.11","145992435","145996579","negative",3302,"GO:0004857///GO:0005515///GO:0031625","GO:0000122///GO:0006606///GO:0007049///GO:0009410///GO:0009612///GO:0009749///GO:0015031///GO:0030216///GO:0032355///GO:0032570///GO:0042127///GO:0042542///GO:0043065///GO:0043086///GO:0048008///GO:0051592///GO:0051782///GO:0071228","GO:0005634///GO:0005737///GO:0005758///GO:0005829","enzyme inhibitor activity///protein binding///ubiquitin protein ligase binding","negative regulation of transcription by RNA polymerase II///protein import into nucleus///cell cycle///response to xenobiotic stimulus///response to mechanical stimulus///response to glucose///protein transport///keratinocyte differentiation///response to estradiol///response to progesterone///regulation of cell population proliferation///response to hydrogen peroxide///positive regulation of apoptotic process///negative regulation of catalytic activity///platelet-derived growth factor receptor signaling pathway///response to calcium ion///negative regulation of cell division///cellular response to tumor cell","nucleus///cytoplasm///mitochondrial intermembrane space///cytosol","Downregulated"
10644,0.00111,6.64e-05,0.4005,-3.988889,-1.5975292,27.77,"IGF2BP2","insulin like growth factor 2 mRNA binding protein 2","IMP-2|IMP2|VICKZ2","protein-coding","ENSG00000073792","active","NC_000003.12","185643130","185825046","negative",6691,"GO:0003723///GO:0003729///GO:0003730///GO:0005515///GO:0045182///GO:0048027///GO:1990247","GO:0001817///GO:0007399///GO:0009653///GO:0010468///GO:0017148///GO:0051028///GO:0051252///GO:0070934","GO:0000932///GO:0005634///GO:0005737///GO:0005829///GO:0005856///GO:0010494","RNA binding///mRNA binding///mRNA 3'-UTR binding///protein binding///translation regulator activity///mRNA 5'-UTR binding///N6-methyladenosine-containing RNA binding","regulation of cytokine production///nervous system development///anatomical structure morphogenesis///regulation of gene expression///negative regulation of translation///mRNA transport///regulation of RNA metabolic process///CRD-mediated mRNA stabilization","P-body///nucleus///cytoplasm///cytosol///cytoskeleton///cytoplasmic stress granule",0.33947772,0.0974,0.4678,1.6577177,0.775424,31.04,"IGF2BP2","insulin like growth factor 2 mRNA binding protein 2","IMP-2|IMP2|VICKZ2","protein-coding","ENSG00000073792","active","NC_000003.12","185643130","185825046","negative",6691,"GO:0003723///GO:0003729///GO:0003730///GO:0005515///GO:0045182///GO:0048027///GO:1990247","GO:0001817///GO:0007399///GO:0009653///GO:0010468///GO:0017148///GO:0051028///GO:0051252///GO:0070934","GO:0000932///GO:0005634///GO:0005737///GO:0005829///GO:0005856///GO:0010494","RNA binding///mRNA binding///mRNA 3'-UTR binding///protein binding///translation regulator activity///mRNA 5'-UTR binding///N6-methyladenosine-containing RNA binding","regulation of cytokine production///nervous system development///anatomical structure morphogenesis///regulation of gene expression///negative regulation of translation///mRNA transport///regulation of RNA metabolic process///CRD-mediated mRNA stabilization","P-body///nucleus///cytoplasm///cytosol///cytoskeleton///cytoplasmic stress granule","Downregulated"
10964,0.0311,0.00661,0.4226,-2.71582,-1.1476286,333.32,"IFI44L","interferon induced protein 44 like","C1orf29|GS3686|TLDC5B","protein-coding","ENSG00000137959","active","NC_000001.11","78620387","78646145","positive",5918,"GO:0003674///GO:0005525","GO:0006955///GO:0051607","GO:0005575///GO:0005737","molecular_function///GTP binding","immune response///defense response to virus","cellular_component///cytoplasm",0.3385846,0.0969,0.3994,-1.6598403,-0.6628646,207.96,"IFI44L","interferon induced protein 44 like","C1orf29|GS3686|TLDC5B","protein-coding","ENSG00000137959","active","NC_000001.11","78620387","78646145","positive",5918,"GO:0003674///GO:0005525","GO:0006955///GO:0051607","GO:0005575///GO:0005737","molecular_function///GTP binding","immune response///defense response to virus","cellular_component///cytoplasm","Downregulated"
10974,0.000338,1.31e-05,0.3127,-4.358783,-1.3628522,93.93,"ADIRF","adipogenesis regulatory factor","AFRO|APM2|C10orf116|apM-2","protein-coding","ENSG00000148671","active","NC_000010.11","86968482","86970915","positive",627,"GO:0003674///GO:0005515","GO:0030154///GO:0045600///GO:0045944","GO:0005634///GO:0005654///GO:0005829///GO:0070062","molecular_function///protein binding","cell differentiation///positive regulation of fat cell differentiation///positive regulation of transcription by RNA polymerase II","nucleus///nucleoplasm///cytosol///extracellular exosome",0.48153597,0.199,0.2372,-1.2853963,-0.3048556,233.73,"ADIRF","adipogenesis regulatory factor","AFRO|APM2|C10orf116|apM-2","protein-coding","ENSG00000148671","active","NC_000010.11","86968482","86970915","positive",627,"GO:0003674///GO:0005515","GO:0030154///GO:0045600///GO:0045944","GO:0005634///GO:0005654///GO:0005829///GO:0070062","molecular_function///protein binding","cell differentiation///positive regulation of fat cell differentiation///positive regulation of transcription by RNA polymerase II","nucleus///nucleoplasm///cytosol///extracellular exosome","Downregulated"
